id,mask,thongtin,image,nu,nam,dotuoi,danam,danu,ngswap,vtrinam,tomLuocText
1,TT,"On the occasion of the girl's birthday, the boy confessed to her",https://raw.githubusercontent.com/Thang1911/Save_Image/main/Fix%20Image%20(After)/6.jpg,https://raw.githubusercontent.com/Thang1911/Save_Image/main/Fix%20Image%20(After)/6%20(1).png,https://raw.githubusercontent.com/Thang1911/Save_Image/main/Fix%20Image%20(After)/6%20(2).png,28,2,2,0,1,Birthday love confession
2,TT,"When the two were married, the wife discovered that her best friend had confessed to her man",https://raw.githubusercontent.com/spiderdassness/anh_raw/6939541219afa32488a10864b1b4a94c56275e4c/t_t.png,https://raw.githubusercontent.com/spiderdassness/anh_raw/6939541219afa32488a10864b1b4a94c56275e4c/t_t_nu.png,https://raw.githubusercontent.com/spiderdassness/anh_raw/6939541219afa32488a10864b1b4a94c56275e4c/t_t_a.png,38,1,1,2,1,Betrayal of trust
3,TT,Discovered ex-lover proposed to another girl on the street,https://raw.githubusercontent.com/Thang1911/Save_Image/main/15/15-3.png,https://raw.githubusercontent.com/Thang1911/Save_Image/main/15/15-3(1).png,https://raw.githubusercontent.com/Thang1911/Save_Image/main/15/15-3(2).png,30,1,1,0,0,Heartbroken on the street
4,TT,The girl was confessed to by the boy in the garbage dump.,https://raw.githubusercontent.com/Thang1911/Save_Image/main/15/15-4.jpg,https://raw.githubusercontent.com/Thang1911/Save_Image/main/15/15-4(1).png,https://raw.githubusercontent.com/Thang1911/Save_Image/main/15/15-4(2).png,28,0,2,0,1,Garbage dump confession
5,TT,The boy confessed but the girl refused because she already has someone she likes,https://raw.githubusercontent.com/Thang1911/Save_Image/main/15/15-5.jpg,https://raw.githubusercontent.com/Thang1911/Save_Image/main/15/15-5(1).png,https://raw.githubusercontent.com/Thang1911/Save_Image/main/15/15-5(2).png,28,0,1,1,0,Unrequited love
6,TT,"When he was drunk, the boy confessed his love to the girl",https://raw.githubusercontent.com/Thang1911/Save_Image/main/15/15-6.jpg,https://raw.githubusercontent.com/Thang1911/Save_Image/main/15/15-6(2).png,https://raw.githubusercontent.com/Thang1911/Save_Image/main/15/15-6(1).png,30,5,5,0,1,Drunken love confession
7,TT,The girl who regrets rejecting another guy's confession to marry is now a ghost man.,https://raw.githubusercontent.com/Thang1911/Save_Image/main/Fix%20data/2.jpg,https://raw.githubusercontent.com/Thang1911/Save_Image/main/Fix%20data/2%20(1).png,https://raw.githubusercontent.com/Thang1911/Save_Image/main/Fix%20data/2%20(2).png,30,4,4,0,1,Ghost of regret
8,TT,The girl rejects the guy because he is a Luffy pirate pirate.,https://i.ibb.co/QDwzsvP/pirate-couple-posing-at-2009-fantasy-fair-arcen-netherlands-europe-BGF8-BF.jpg,https://i.ibb.co/w4Dwsr1/toolxox-com-split-image-55.png,https://i.ibb.co/Sd3zhNy/toolxox-com-split-image-54.png,30,1,0,1,1,Love lost to the sea
9,TT,"Accepted the boy's confession, but the girl's family objected because of her family background",https://raw.githubusercontent.com/Thang1911/Save_Image/main/15/15-9.jpg,https://raw.githubusercontent.com/Thang1911/Save_Image/main/15/15-9(1).png,https://raw.githubusercontent.com/Thang1911/Save_Image/main/15/15-9(2).png,28,0,1,0,0,Love forbidden by family
10,TT,"The girl cursed at the boy, for confessing there was only a flower but not a branded bag",https://raw.githubusercontent.com/Thang1911/Save_Image/main/Fix%20data/1.jpg,https://raw.githubusercontent.com/Thang1911/Save_Image/main/Fix%20data/1%20(2).png,https://raw.githubusercontent.com/Thang1911/Save_Image/main/Fix%20data/1%20(1).png,28,0,1,0,1,Materialistic love
11,TT,The boy confessed his love so romantic that it made the girl sleepless all night.,https://i.ibb.co/0CN4TTZ/Sleep-Disorders.jpg,https://i.ibb.co/0YFHCrW/toolxox-com-split-image-56.png,https://i.ibb.co/qjRDNPZ/toolxox-com-split-image-57.png,28,1,1,0,0,Love confession insomnia
12,TT,The girl told her best friend about the boy who confessed to her. But unexpectedly he is the secret lover of her best friend,https://raw.githubusercontent.com/Thang1911/Save_Image/main/15/15-12.jpg,https://raw.githubusercontent.com/Thang1911/Save_Image/main/15/15-12(1).png,https://raw.githubusercontent.com/Thang1911/Save_Image/main/15/15-12(2).png,28,1,1,0,0,Best friend's secret lover
13,TT,The boy sent a love letter to the girl but his best friend hid it.,https://raw.githubusercontent.com/Thang1911/Save_Image/main/15/15-13.jpg,https://raw.githubusercontent.com/Thang1911/Save_Image/main/15/15-13(2).png,https://raw.githubusercontent.com/Thang1911/Save_Image/main/15/15-13(1).png,25,0,1,0,1,Love letter intercepted
14,TT,"Right in front of the group of friends, the boy confessed to the girl. The girl agrees but it's a bet",https://raw.githubusercontent.com/spiderdassness/anh_raw/d8807bd3687ed0898d4b5f908cd811ce9e8ce0f0/tu.png,https://raw.githubusercontent.com/spiderdassness/anh_raw/d8807bd3687ed0898d4b5f908cd811ce9e8ce0f0/tu_nu.png,https://raw.githubusercontent.com/spiderdassness/anh_raw/d8807bd3687ed0898d4b5f908cd811ce9e8ce0f0/tu_nam.png,25,1,1,1,1,Love confession as a bet
15,TT,"After 4 failed confessions, he decided to give up on the girl and go with his best friend",https://raw.githubusercontent.com/Thang1911/Save_Image/main/15/15-15.jpg,https://raw.githubusercontent.com/Thang1911/Save_Image/main/15/15-15(2).png,https://raw.githubusercontent.com/Thang1911/Save_Image/main/15/15-15(1).png,25,2,2,0,0,"Love lost, friendship found"
16,TT,"The boy who confessed to his boss was rejected, because she thought he was greedy.",https://raw.githubusercontent.com/Thang1911/Save_Image/main/15/15-16.jpg,https://raw.githubusercontent.com/Thang1911/Save_Image/main/15/15-16(2).png,https://raw.githubusercontent.com/Thang1911/Save_Image/main/15/15-16(1).png,25,2,2,0,1,Love lost to doubt
17,TT,The 30-year-old boy confessed unsuccessfully because he bought a fake ring for the girl.,https://raw.githubusercontent.com/Thang1911/Save_Image/main/15/15-17.jpg,https://raw.githubusercontent.com/Thang1911/Save_Image/main/15/15-17(2).png,https://raw.githubusercontent.com/Thang1911/Save_Image/main/15/15-17(1).png,30,0,0,0,1,Love lost to deception
18,TT,"In order to quickly inherit the family's career, the guy gave up the confession of the girl he loved to marry the daughter of a tycoon family.",https://raw.githubusercontent.com/spiderdassness/anh_raw/6939541219afa32488a10864b1b4a94c56275e4c/t_t.png,https://raw.githubusercontent.com/spiderdassness/anh_raw/6939541219afa32488a10864b1b4a94c56275e4c/t_t_nu.png,https://raw.githubusercontent.com/spiderdassness/anh_raw/6939541219afa32488a10864b1b4a94c56275e4c/t_t_a.png,30,1,1,0,1,Love sacrificed for ambition
19,TT,"Unable to accept that the girl was close to other men, he decided to confess to the girl. But she rejected him because she didn't like him because he was poor",https://raw.githubusercontent.com/Thang1911/Save_Image/main/15/15-19.jpg,https://raw.githubusercontent.com/Thang1911/Save_Image/main/15/15-19%20(2).png,https://raw.githubusercontent.com/Thang1911/Save_Image/main/15/15-19%20(1).png,28,1,1,0,0,"Love rejected, poverty a barrier"
20,TT,"The girl was very happy when the boy confessed, but suddenly another girl appeared and claimed to be his fiancée",https://raw.githubusercontent.com/Thang1911/Save_Image/main/Fix%20Image%20(After)/7.jpg,https://raw.githubusercontent.com/Thang1911/Save_Image/main/Fix%20Image%20(After)/7%20(1).png,https://raw.githubusercontent.com/Thang1911/Save_Image/main/Fix%20Image%20(After)/7%20(2).png,28,1,1,0,1,Love triangle heartbreak
21,TT,"Right at the wedding ceremony, the girl canceled the wedding because she discovered that her boyfriend's house was poor. The guy directly confessed to his best friend and left the wedding",https://raw.githubusercontent.com/Thang1911/Save_Image/main/15/15-21.jpg,https://raw.githubusercontent.com/Thang1911/Save_Image/main/15/15-21(2).png,https://raw.githubusercontent.com/Thang1911/Save_Image/main/15/15-21(1).png,30,1,1,0,0,Love lost to materialism
22,TT,The boy who confessed was rejected by the girl from the first sentence because his mouth was so rotten that she couldn't stand it.,https://raw.githubusercontent.com/Thang1911/Save_Image/main/15/15-22.jpg,https://raw.githubusercontent.com/Thang1911/Save_Image/main/15/15-22(2).png,https://raw.githubusercontent.com/Thang1911/Save_Image/main/15/15-22(1).png,30,1,1,0,0,Love lost to bad breath
23,TT,The boy who confessed failed because he was so handsome that the girl didn't feel safe around him.,https://raw.githubusercontent.com/spiderdassness/anh_raw/62e3c05d67984a43d918c7bd2d3acf29756fbee4/hh.jpg,https://raw.githubusercontent.com/spiderdassness/anh_raw/62e3c05d67984a43d918c7bd2d3acf29756fbee4/hh_nu.jpg,https://raw.githubusercontent.com/spiderdassness/anh_raw/62e3c05d67984a43d918c7bd2d3acf29756fbee4/hh_nam.jpg,28,0,1,0,1,"Too handsome, too dangerous"
24,TT,The girl thought the guy she asked to kiss her but found out it wasn't herself but her best friend,https://raw.githubusercontent.com/Thang1911/Save_Image/main/15/15-24.jpg,https://raw.githubusercontent.com/Thang1911/Save_Image/main/15/15-24(1).png,https://raw.githubusercontent.com/Thang1911/Save_Image/main/15/15-24(2).png,20,1,1,0,0,Kiss of mistaken identity
25,TT,"After two months of accepting the confession, the girl discovered that the boy was a promiscuous boy and digger",https://raw.githubusercontent.com/Thang1911/Save_Image/main/15/15-25.jpg,https://raw.githubusercontent.com/Thang1911/Save_Image/main/15/15-25(2).png,https://raw.githubusercontent.com/Thang1911/Save_Image/main/15/15-25(1).png,28,1,0,0,1,Relationship's foundation cracked
